{
  "status": "expired",
  "authorization_id": "auth_01J9X2",
  "checked": "2026-09-28T14:02:11Z",
  "valid_until": "2026-09-28T14:17:11Z",
  "stale_until": "2026-09-29T14:02:11Z",
  "product": {
    "in_catalog": true,
    "id": "EB-TEE-BLK-M",
    "product_line": "Classic Tee"
  },
  "observed": null,
  "signals": [],
  "signature": {
    "kid": "ar-20260928-6e37",
    "jws": "eyJhbGciOiJFZERTQSIsImtpZCI6ImFyLTIwMjYwOTI4LTZlMzcifQ..c2lnbmF0dXJlLXBsYWNlaG9sZGVy"
  },
  "expires": "2026-09-01T00:00:00Z"
}
